{
  "after": {
    "captured_at": "2026-09-08T00:00:00Z",
    "content": "<html><head><title>Acme Analytics</title></head><body>\n<header><nav><a href=\"/\">Home</a><a href=\"/features\">Features</a><a href=\"/changelog\">Changelog</a><a href=\"/pricing\">Pricing</a></nav></header>\n<main>\n<div class=\"status\">All systems operational</div>\n<h1>Acme Analytics</h1>\n<img src=\"/hero-2026-08.png\" alt=\"Acme Analytics dashboard\">\n<p>Product analytics for small product teams.</p>\n<ul class=\"features\"><li>Real-time dashboards</li><li>CSV export</li><li>Bulk export</li><li>Role-based access control</li></ul>\n<ul class=\"integrations\"><li>Webhook integration</li><li>S3 export integration</li></ul>\n<p class=\"support\">Support: email support, 2 business days.</p>\n<p>Read the <a href=\"/docs/exports\">export documentation</a>.</p>\n<ul class=\"changelog\"><li>2026-08-14 \u2014 Improved CSV export performance.</li></ul>\n<p>Setup takes minutes; no enginering time required.</p>\n<p class=\"testimonial\">\"We shipped our first funnel report in an hour.\" \u2014 Sam, product manager</p>\n</main>\n<footer><p>\u00a9 2025 Acme Analytics</p><p><a href=\"/legal\">Legal</a> \u00b7 <a href=\"/blog\">Blog</a></p></footer>\n</body></html>",
    "content_type": "text/html"
  },
  "before": {
    "captured_at": "2026-09-01T00:00:00Z",
    "content": "<html><head><title>Acme Analytics</title></head><body>\n<header><nav><a href=\"/\">Home</a><a href=\"/features\">Features</a><a href=\"/changelog\">Changelog</a><a href=\"/pricing\">Pricing</a></nav></header>\n<main>\n<div class=\"status\">All systems operational</div>\n<h1>Acme Analytics</h1>\n<img src=\"/hero-2026-08.png\" alt=\"Acme Analytics dashboard\">\n<p>Product analytics for small product teams.</p>\n<ul class=\"features\"><li>Real-time dashboards</li><li>CSV export</li><li>Role-based access control</li></ul>\n<ul class=\"integrations\"><li>Webhook integration</li><li>S3 export integration</li></ul>\n<p class=\"support\">Support: email support, 2 business days.</p>\n<p>Read the <a href=\"/docs/exports\">export documentation</a>.</p>\n<ul class=\"changelog\"><li>2026-08-14 \u2014 Improved CSV export performance.</li></ul>\n<p>Setup takes minutes; no enginering time required.</p>\n<p class=\"testimonial\">\"We shipped our first funnel report in an hour.\" \u2014 Sam, product manager</p>\n</main>\n<footer><p>\u00a9 2025 Acme Analytics</p><p><a href=\"/legal\">Legal</a> \u00b7 <a href=\"/blog\">Blog</a></p></footer>\n</body></html>",
    "content_type": "text/html"
  },
  "case_id": "held-product-001",
  "detector": "product_change",
  "edge_case": false,
  "expected": {
    "fixture_note": "Static fixture: authored page snapshots and labels, not real Jev output. Values are fixtures, never live model judgements."
  },
  "label": {
    "labeling": {
      "adjudication": null,
      "labeler": "rubric-labeled-draft (ai-author: hermes/jack-dev)",
      "method": "single-labeler + pre-approved written rubric (docs/provenance-and-labeling.md)",
      "notes": "Static fixture label produced against docs/provenance-and-labeling.md; independent human review/adjudication has not been recorded. Not a Jev output.",
      "review_status": "pending-independent-review",
      "rubric_version": "1.0"
    },
    "meaningful": true,
    "rationale": "A new Bulk export capability was added to the feature list.",
    "should_alert": true
  },
  "provenance": "synthetic",
  "provenance_detail": {
    "authored_by": "replynodes/jev-change-monitor",
    "kind": "synthetic",
    "license": "Apache-2.0 (authored for this repository)",
    "notes": "Fictional page content for 'Acme Analytics'. Not a real product, customer or page copy.",
    "permission": "n/a \u2014 no third-party content",
    "retrieved_at": null,
    "source_url": null
  },
  "split": "held_out",
  "subtype": "feature_added",
  "url": "https://example.invalid/product/feature_added"
}
