{
  "after": {
    "captured_at": "2026-09-08T00:00:00Z",
    "content": "<html><head><title>Pricing \u2014 Acme Analytics</title></head><body>\n<header><nav><a href=\"/\">Home</a><a href=\"/pricing\">Pricing</a><a href=\"/docs\">Docs</a></nav></header>\n<main>\n<h1>Simple pricing</h1>\n<table class=\"plans\">\n<tr><th>Plan</th><th>Price</th><th>Usage</th><th>Seats</th><th>Storage</th></tr>\n<tr><td>Starter</td><td>$29/month</td><td>50,000 API calls / month</td><td>5 seats</td><td>1 GB storage</td></tr>\n<tr><td>Growth</td><td>$99/month</td><td>100,000 API calls / month</td><td>25 seats</td><td>50 GB storage</td></tr>\n<tr><td>Scale</td><td>$299/month</td><td>1,000,000 API calls / month</td><td>100 seats</td><td>500 GB storage</td></tr>\n</table>\n<section class=\"details\">\n<ul class=\"addons\"><li>SSO add-on: $20/month per workspace</li></ul>\n<ul class=\"usage\"><li>Overage: $0.02 per 1,000 API calls</li></ul>\n<p class=\"trial\">14-day free trial on every plan.</p>\n<p class=\"free\">Free tier: 1,000 API calls / month, 1 seat.</p>\n<p>You can recieve usage alerts by email.</p>\n<p class=\"faq\">Read the <a href=\"/docs/faq\">pricing FAQ</a>.</p>\n</section>\n<section class=\"testimonials\"><blockquote>The plans finally match how we grow.</blockquote><p>Dana, platform engineer</p></section>\n</main>\n<footer><p>\u00a9 2025 Acme Analytics</p></footer>\n</body></html>",
    "content_type": "text/html"
  },
  "before": {
    "captured_at": "2026-09-01T00:00:00Z",
    "content": "<html><head><title>Pricing \u2014 Acme Analytics</title></head><body>\n<header><nav><a href=\"/\">Home</a><a href=\"/pricing\">Pricing</a><a href=\"/docs\">Docs</a></nav></header>\n<main>\n<h1>Simple pricing</h1>\n<table class=\"plans\">\n<tr><th>Plan</th><th>Price</th><th>Usage</th><th>Seats</th><th>Storage</th></tr>\n<tr><td>Starter</td><td>$29/month</td><td>10,000 API calls / month</td><td>5 seats</td><td>1 GB storage</td></tr>\n<tr><td>Growth</td><td>$99/month</td><td>100,000 API calls / month</td><td>25 seats</td><td>50 GB storage</td></tr>\n<tr><td>Scale</td><td>$299/month</td><td>1,000,000 API calls / month</td><td>100 seats</td><td>500 GB storage</td></tr>\n</table>\n<section class=\"details\">\n<ul class=\"addons\"><li>SSO add-on: $20/month per workspace</li></ul>\n<ul class=\"usage\"><li>Overage: $0.02 per 1,000 API calls</li></ul>\n<p class=\"trial\">14-day free trial on every plan.</p>\n<p class=\"free\">Free tier: 1,000 API calls / month, 1 seat.</p>\n<p>You can recieve usage alerts by email.</p>\n<p class=\"faq\">Read the <a href=\"/docs/faq\">pricing FAQ</a>.</p>\n</section>\n<section class=\"testimonials\"><blockquote>The plans finally match how we grow.</blockquote><p>Dana, platform engineer</p></section>\n</main>\n<footer><p>\u00a9 2025 Acme Analytics</p></footer>\n</body></html>",
    "content_type": "text/html"
  },
  "case_id": "held-saas-003",
  "detector": "saas_pricing",
  "edge_case": false,
  "expected": {
    "fixture_note": "Static fixture: authored page snapshots and labels, not real Jev output. Values are fixtures, never live model judgements."
  },
  "label": {
    "labeling": {
      "adjudication": null,
      "labeler": "rubric-labeled-draft (ai-author: hermes/jack-dev)",
      "method": "single-labeler + pre-approved written rubric (docs/provenance-and-labeling.md)",
      "notes": "Static fixture label produced against docs/provenance-and-labeling.md; independent human review/adjudication has not been recorded. Not a Jev output.",
      "review_status": "pending-independent-review",
      "rubric_version": "1.0"
    },
    "meaningful": true,
    "rationale": "Starter usage limit rose from 10,000 to 50,000 API calls per month.",
    "should_alert": true
  },
  "provenance": "synthetic",
  "provenance_detail": {
    "authored_by": "replynodes/jev-change-monitor",
    "kind": "synthetic",
    "license": "Apache-2.0 (authored for this repository)",
    "notes": "Fictional page content for 'Acme Analytics'. Not a real product, customer or page copy.",
    "permission": "n/a \u2014 no third-party content",
    "retrieved_at": null,
    "source_url": null
  },
  "split": "held_out",
  "subtype": "limit_change",
  "url": "https://example.invalid/saas/limit_change"
}
